,0
206,Hi  Ive been playing around with a key stretch algorithm that I have invented and I would love to hear if anyone can find any weakness in it Ive posted it in a few places and so far with the exception of a small flaw that was fixed I haven found any  I base it on the idea that I want to use the simplicity of a one time pad but to have a considerably shorter key Now when I say short key I dont mind a key of many bytes say 256 since memory bandwidth is cheap but I do want one that is extremely fast to precess  If we have a small key we should be able to procedurally generate an infinitely long key from the initial key seed At this point anyone who knows anything about encryption can see an obvious weakness here: the procedural algorithm will produce a pattern that can be found and used to break the key True but that is a mathematical way of thinking about it: a specific algorithm yields a specific pattern But what if the algorithm isnt specific? What if the key describes the algorithm? If the key is data that can be used as an algorithm to produce data then we can create a cycle where the algorithm is self modifying and therefor wont create a pattern if we add the plain text in to this self modifying code then the only way of predicting the code would be to have the plaintext  One way of thinking about it is to imagine the encryption algorithm as a virtual machine that produces a one time pad and new instructions for the virtual machine All we really need to do is to ensure that the virtual machine never gets stuck in a loop where it produces an output that makes it repeat its previous operations over and over  Thats pretty much the basic idea and once you start to think about it you realize that you dont need a full virtual machine you can do something much simpler that has similar characteristics  Here is the algorithm:  pos_a = key[0]  key_size;    pos_b = key[1]  key_size;    pos_c = key[2]  key_size;     fori = 0; i < length; i    {        old_a = pos_a;        pos_a = key[pos_b]  key_size;        pos_b = pos_a  1  key[pos_c]  key_size  1  key_size;        pos_c = pos_a  1  key[old_a]  key_size  1  key_size;        decrypted[i] = encrypted[i] ^ key[pos_a] ^ key[pos_b];        key[pos_c] = key[pos_c] << 31 | key[pos_c] >> 1;        key[pos_a] ^= key[pos_c] ^ decrypted[i];        key[pos_b] ^= i;    }     Lets go over this code and start by first analyzing the key line here:  decrypted[i] = encrypted[i] ^ key[pos_a] ^ key[pos_b];     This is the encryption using a simple XOR XOR in it self is unbreakable because any input can yield any output with the right key value However If we reuse the same XOR key more then once it becomes possible to guess the key The assumption of any encryption algorithm must always be to make the message unbreakable even if the breaker has a part of the message in plain text So the first thing we do is to XOR with 2 different parts of the key; key[pos_a] and key[pos_b] The breaker now knows two numbers that if XORed together will produce the XOR difference between the ciphertext and the plain text if we a working with a 32 bit implementation that means 4 billion combinations Thats a lot but its still a clue So the next thing we do is to destroy that clue:  key[pos_a] ^= key[pos_c] ^ decrypted[i];    key[pos_b] ^= i;    Here we take a third portion of the key key[pos_c] that the adversary still haven got a clue about and use it to destroy one of the two XOR factors To this we add in the decrypted message and a counter that will add a poison pill and prevent the algorithm from getting stuck in a pattern By adding the decrypted message we also add the same entropy as the message it self has to the possible combinations  key[pos_c] = key[pos_c] << 31 | key[pos_c] >> 1;    To make sure we have good entropy we also shift the key one step so that we arent constantly XORing the same bits Then finally we get to this:  old_a = pos_a;    pos_a = key[pos_b]  key_size;    pos_b = pos_a  1  key[pos_c]  key_size  1  key_size;    pos_c = pos_a  1  key[old_a]  key_size  1  key_size;     Here we simply use the key to recursively select the 3 sections of our key we will use in our above algorithm Since none of these position values are exposed they obfuscate how the algorithm work as they will just modify how the algorithm selects its key values they wont actually be used in the math relating to the message Since the keys at pos_a and pos_c will be XORed to destroy the key they cant be the same and since the key at pos_a and pos_b are used to decrypt the message they cant be the same The core idea here is that the adversary can guess the relation shit between two values in the key but not what part of the key as that process is fenced of from the encryption process  I would love to see if anyone can show a weakness in this If you want to try here are a few assumptions you can make: The key is only used once and is random but assume that you have access to both the encrypted and a significant part of the plain text message The encryption should hold up even if an attacker can accurately guess significant parts of the plain text Im very curious as to how the key size and amount of plain text data is given can impact the security of the encryption My guess is that keysize needs to be at least 7 however the above code is 32 bit but on a 64bit processor it would theoretically be twice as fast in 32 bit mode so it may make sense to have 7  64 bit or larger keys  This is one of thous times I wish i was very rich so that i could offer up a big cash price but maybe i can owe you beer if you break it?  You can download source from: http:wwwquelsolaarcomcrypto_testc
207,My app lets users encipher their text messages using 9 different ciphers:   Atbash Cipher  Caesar Shift Cipher  Keyboard Code  LetterNumber Code  Monoalphabetic Substitution Cipher  Morse Code  Rail Fence Cipher  Rot 13 Cipher  Vigenere Cipher   I recently found out about rcryptography and Id love any feedback you guys have or suggestions of other ciphers that could reasonably be used to encrypt text messages  Thanks  iOS: [Cipher Sender]https:itunesapplecomusappciphersenderid548958077  Android: [Cipher Sender]https:playgooglecomstoreappsdetails?id=comhigh5ciphersenderhl=en  edit: Please remember that all of these ciphers are for novelty use only and none of these ciphers should be considered secure Due to their historical nature a method for cracking each one is well documented and they are all crackable with only a reasonable amount of work Highly sensitive information should be secured by much stronger means 
208,Guys Ive no clue where to start to be honest I would like to be able to learn about cryptography Im not even sure if what it is that I am thinking is the right thing Basically I would like to be able to decipher the puzzles in the daily paper I would like to be able to play the puzzle games to sharpen my mind a bit Essentially I would like to be able to write in code that I could then actually read myself   Thanks all 
209,I just started coming up with this idea of a form of cryptography Earlier this year I took an interest in cryptography and read a couple books on it This idea of mine it seems similar to a Vigenere cipher but it moves  I dont really mind people seeing this and Id like some feedback tell me if its already been done or something along the same lines  Anyway heres my idea the number in the topleft of each image matches the step number http:imgurcomaao5bO0  Now to explain how it works  Step 1: Choose a shape and then decide on a box size depending on the size of your shape you should be able to multiply your box size ie 3x3 by the number of corners the shape has and have at least 26          ie I used a square with a 3x3 box 4x3x3 = 36 which is indeed >26  Step 2: Create your boxes in the corners of your shape this is not necessary but definitely helps with organization  Step 3: Now you are going to start the top or topleft of your shape and starting writing down the alphabet I might want to change this each letter you write you go to the next corner going clockwise and write the next letter and so on   Step 4: This is the encryption decryption process So take the word Dad and put it in What you do is essentially turn the letter into its corresponding number So D = 4 fourth letter in the alphabet A = 1 Now you count over that much in the key you have created  In my case it results in BAB  Step 5: Well not very advanced just complicated Thats just the beginning So to prevent people from cracking the code an extra layer of security has been added The next step involves rotating the corners Once the amount of letters youve encrypted or decrypted is equal to the number of corners you have you shift them You can choose the direction it is specified in the key you give the other party Ill explain later  Say the shift is clockwise In my case this message: Hello will become QFVVG For an image of my rotation heres a screencap http:prntscrcom4bvlqv  After Ive done 4 letters everything cycles and I get a G instead of a D  Step 6: Moreover you can also put in the key directions for rotating each corner individually  In my case instead of the first block counting D=1 H=2 L=3 it now reads P=1 D=2 Y=3   The most important part of the encryption process is how you give the key to somebody This is by far the most complex part The key for mine looks like this:  3a3n4nA  The key is basically all of this information: 3x3 corners 4 cornered shape rotate the first cycle and cycle clockwise   To break this down The a and ns around the 3s and 4 represent when to do step 6 Note: A cycle is step 5 The a means a clockwise turn because everybody thinks clockwise first a z would represent a counterclockwise turn everybody thinks of counterclockwise last The ns represent null or in other words you dont rotate The capital A at the end means clockwise cycles whereas a capital Z would represent counterclockwise cycles   So when somebody sees this they know: Its a 4cornered shape the corners are 3x3 cycle clockwise and rotate each corner clockwise the first time we cycle dont rotate the next cycle dont rotate the next cycle and then rotate clockwise again And so on  This is a fairly complicated process but I think its an interesting way to encrypt and decrypt Id love to hear feedback   Thank you for reading
210,I attempted to contact ProtonMail with my concerns prior to this disclosure which is embarrassingly simple to see I received no response  If you send a message to a nonPM user you provide a symmetric passphrase which is then used to encrypt the message and the recipient is sent an email with a link to a webpage that will allow decryption of the message inbrowser  If you load the source code to ProtonMails encryption from https:protonmailchjscomposerjs which is embarrassingly amateurish looking at points you will see the line at which this occurs:       if outside recipeints are encrypted:     if encOutsideis:checked {             encrypt the message symetrically for outside recipients using the message and a hash of the pw       messageBody = encryptMessagemessageBody openpgpcryptohashsha256outsidePwval;             append to the total package and carry on       totalPackagevaltotalPackageval;{emailArray[index] type messageBody};          }       They are not using PBKDF2 scrypt or any other keystretching algorithm allowing for efficient bruteforce attacks These attacks would be easy to perform offline because their method of transmitting the encrypted data is to embed it in a hidden div in the resulting webpage their SSL implementation also does not support PFS They are also apparently reusing key material given that two messages encrypted with the same passphrase will use the same encryption key  Decryption code for comparison: https:protonmailchjsdecryptjs  Relevant application code including the pgpEncrypt code showing an error at the top of the file as well: https:protonmailchmin?g=appjs804   I have serious concerns about a securitybased email platform with code of this quality
211,Ive seen many estimates of how long it would take to break AES128 Very often the numbers are something crazy high like 1E181 billion billion years Almost all such estimates dont account for advances in technologyMoores law Leaving aside the discussion of the sustainability of Moores law I decided to compute how long it would take to break AES128 The answer? 115 years   Im not a mathematician or a professional cryptographer so I would appreciate input Ive posted my spreadsheet I used to do my calculations so constructive comments are appreciated   http:shikhirsinghblogspotcom201407mooreslawandbruteforceforaeshtml
212,Or maybe even a few seconds for it to be practical in the real world
213,Is anyone aware of a cipher that might somehow be tied to Kurt Vonneguts The Sirens of Titan chronosynclastic infundibulum or The Breakfast of Champions?  Ive done lots of googling and checked my stash of cryptography websites with no luck  The message is in groups of four letters like this:  IHWG GVUQ and so forth
214,I have a homework problem asking me how an eavesdropper found out a message sent by one person to 3 people knowing their public keys and the transmitted message Something like this:  Alice is sending a message to 3 people and Mallory found this:  Receiver Encrypted message Public key  Bob 674 3337 3  Charlie 36 187 3  David 948 1219 3  How did Mallory do it? Factoring the keys is not a viable solution At first I thought of trying to find common factors between all the keys as they would have shared private primes using that to find the other private prime then using that to find the decryption key But they dont share any private primes so Im stuck Any help or tips would be great Thank you
215,Detailed description is available on [bittext]http:bittextchuEraFW1b51 or [pastebin]http:pastebincomtsRuVUjY if you prefer  AOTP is an OTP based algorithm to release multiple files to the public without reusing a key but keeping control when a file can be decrypted  It mainly differs in the following points:   Creator decides when parts can be decrypted depending on when he releases them  Only one key is generated per chain The key is only applied to one file no matter how many files are in the chain  The key cannot be constructed from the files it was not applied to  Please tell me what you think about it
216,So I read [this]https:enwikipediaorgwikiCryptographic_hash_function wikipedia article and Id like to know whether it could be possible to develop a human hashing algorithm? This would utilise something that only humans can do and is difficult for PCs does this have a name actually?  Id like to know this because I have an idea to make HumanCoin where humans would do proofofwork I posted [this]http:wwwredditcomrCryptoCurrencycomments1xaaavcrazy_idea_humancoin on the rCryptoCurrency sub
217,I have a pgp key uploaded to a keyserver I now want to share it in my emails via my signature Whats the bestproper way to to this? Should I add my keyID to my email sig or should I use my key fingerprint? Maybe both?   Are there any advantages or disadvantages of keyID vs fingerprint?
218,Before asking my question directly I think it is important that I explain what I am not asking  To be sure I am not making any reference to the recent Intel [RdRand debacle]https:enwikipediaorgwikiRdRand  I fully understand that this kind of hardware randomnumber generation is not provably secure in the same way that open source code eg `devurandom` is  So with that out of the way my question is as follows:  Given that highquality [hardware random number generators]https:enwikipediaorgwikiHardware_random_number_generator appear to  generate their data from quantum processes which are truly random can any such devices be fully trusted?  More specifically:  1 Is it theoretically possible to modify these devices to reduce their randomness such that a security audit would not reveal the backdoor cf `RdRand`?  2 If not are there vendors whose designs and products have been audited in depth?
219,http:enwikipediaorgwikiBirthday_problemCalculating_the_probability  If you want to use all the computers on the planet running for as long as the universe has ever existed to try to crack one private key then maybe it wont be cracked but if you have every computer generating new publicprivate key pairs then how long until one computer accidentally generates a pair that has already been generated?  As I understand the Birthday Problem suggests that this conflict is significantly more likely Is 256 bits chosen to account for that? Im assuming it is but I dont actually know  Looking [at this]http:uploadwikimediaorgmath9c79c7763ad00291fc5be64923ea6d831d3png I think we want to solve kPnk^n =05 where k is 2^256  and then we want to solve for n n would represent the number of publicprivate keys that have to be generated to get a 50 chance of the same pair being generated twice and therefore potentially causing a conflict
220,Pikyxl Xkarvdl pvvl aga vabrmrne th hbv malpmwp rrtscjms hy kmwmtghz buk rvit uxaairq qw cvfal kivtek xhgi hgg V smax hvv lhrhpxvho pwc fref azxh zkvyq rovr gpeke sivx tuh xuhew erjempepe wxzmsi lwe lmg soeh dxohwxnwere aceivric I frzimj iia aw yunthr vhuxmaxa sj xyml wekl ig tsp dsstapv maie Gkenzo qc nipmkrj absp lreobaecpe ir iqrceq ds mklewbq E ei qfvx jsegekglh xmzp whag noj Hdpfyh avoh vaetx poie M txes ljp un zl kbttnft pbal xuh wphmvm  This was found in a wall on a location of the map Origins which was released for Black Ops 2 yesterday Give a go at decoding it and helping out  Video here: http:wwwyoutubecomwatch?v=9kZ3NTX1lYA
221,Im looking for a way of obfuscating numbers so that they dont look like numbers Also prefer that they dont look like strings of letters so no a=1 b=2 type substitution This doesnt have to be something that would withstand intense scrutiny just something that if people looked at it they would not immediately be able to recognize that it was a numeric sequence Bonus points for something that doesnt look absurd strings of weird symbols and also if it can be easily written down Suggestions?
222,Folks  Is it ok to ask for critiques and learning stuff here?  Im studying the design of some crypto protocols and trying to write a program to store a symmetrically encrypted message in a file so I get cofidentiality integrity and authenticity I am writing it for fun and learning only ie not to be used it in an actual product and will like some feedback  The scheme I figured out is basically generate a message digest of my plain text and encrypt it together with the said plain text;  once I decrypt them I generate a new hash from the decrypted message and check if both are equal If true I assume the message was not tampered with  All information publicly available is either encrypted or randomly generated IVs and salts and since the hash is also encrypted an eavesdroper cant tell I sent the same message twice   The encryption procedure in pseudocode:      l = Lengthcm      h = Hl  cm  p     em = Eh  l  cm  p     sm = s  iv  em   Where:   cm is my clear text message zlib compressed but lets forget this for now;   l is the length of my clear text message basically to separate the message from the padding once its decrypted;   iv is my fixedlength initialization vector read from devurandom;   s is a fixedlength salt used to derive the key from the password also read from devurandom Im using a salted iterated hash of the password to get the key;   em the encrypted message;   sm the stored message ie the encrypted message with also the information needed to initialize the cipher algo for decryption;   p is some kind of padding to fit the block size   h is the hash of length message and padding;    The plus sign which spoiled my formatting things of a reddit n00b is string concatenation;   Length is a function which returns the length on an element as a fixed size unsigned int;   E is my block encryption algo eg AESCBC For simplicity lets assume that its already initialized with the initialization vector iv and a given key   H is a secure message digest algo Im using SHA256    Its easy to get the salt and IV from the stored message they are fixed size so I grab them ask the user for the password generate the key and use it to decrypt the secret part of the message  Once I get it I isolate the hash and check if it matches the hash generated from the rest of the message if not the message is corrupted  If the hash matches I use the stored length to get cm back discarding the padding  In pseudocode assuming l is four bytes long ignoring endianess issues for now and h s and iv are both 32 bytes long:      s = sm[0:32]     iv = sm[32:64]     em = sm[65:]     m = Dem     sh = m[0:32]     hc = Hm[33:]      if sh == hc  Message is valid so split the contents and get cm back   Where:   all names from the previous pseudocode stills valid;   : is string splitting so m[0:42] gets bytes 0 to 41 from the string m  Im writing the code in Python BTW;   D is the cipher already set up for decryption with the key IV etc   sh is for stored hash;   hc is for hash candidate;    This looks sound but also its so trivial that I think everyone who played with crypto came out with this design at least once Oddly I failed to find out an explanation about its insecurity  My questions: Is this thing secure?  Any material I should read? Why should I use HMAC instead of this?  Any other critique for my toy protocol? 
223,http:iimgurcomGe6lxpng   Thank you for your help Found this comment Im debating if Im going to check it out or not  Edit: looks like some one figured it out [here]http:wwwredditcomrAskRedditcomments16r2rxwhats_a_secret_you_have_sworn_never_to_tell_butc7z7lk0 
224,edit 20180907: nuked most of my comments in case i said anything dumb that I forgot about
225,Hello cryptography Im posting here because I figured it applied more to you guys than a programming subreddit based on the track record of my recruitment adventures  Im working on a project called [Sidony]https:githubcomStonedEmuSidony It as a multiplatform commandline encryption tool which is completely open both in development and product Its free and will remain free for people to modify and rerelease etc  Right now the core consists of PBKDF2 for 256bit key derivation using SHA256 as the psuedo random function crutch and then actual file encryption is performed using AES Im recruiting developers to help me with the following tasks:   Verify the standing implementations  Help me with implementing Twofish and Serpent  So why do this when other tools already exist for it? Its a personal improvement project really Im in highschool but plan on studying cryptology in college and to pursue it cryptosystems as a career This project has given me the opportunity to learn a lot of cryptographic principles and tools and lingo and etc and if youre as interested in it as I am its a great opportunity for you to do the same  As for the current state it works on both Windows and Mac OSX but Ive yet to port it to Linux just havent bothered to set up a machine for it Anyway the code is portable given a small change depending on the system which I note in the readme A download for the windows version is available on the git not yet true for the OSX version  My girlfriend is a graphic designer and is working on a GUI I can construct it using Allegro in Windows and theoretically also OSX and Linux and other platforms but Ive got no experience with the others  Anyway thats the background and forward motion for the project and Id love to have some folk join me Contact me here or on my email stonedemu@gmailcom
226,TLDR; Looking for indepth crypto book about bits but still easy to understand or a suggestion for an other crypto subject  Hi  As a 6th grade student 12th grade for you Americans I have to do my thesis at the end of the schoolyear Ive decided to do this about cryptography you guessed it :p  because:   Im following MathsScience and Im thinking about studying ICT when I graduate  I really want to know more about cryptography  Im pretty proficient in Java the programming language I plan on writing some existing algorithmes myself  Now I want to talk the most about cryptography on the bit level but Im having trouble finding books which go indepth but still covers the basics  Wikipedia is kind of difficult Its in English and Im having trouble understanding some difficult words and obviously not allowed Cryptography for dummies looked good but it doesnt go deep enough  Perhaps you guys know some good bookswebsites or perhaps you know another subject?  Thanks
227,Hi everyone A friend and myself are studying older cryptographic functions and have run into a bit of difficulty understanding the Hill cipher We both understand Caesar and Playfair quite easily however neither Google nor our texts gave us a very clear explanation and I was wondering if one of you may be so kind as to help us understand how to set up and encrypt a message say Hello Worldusing the key Keya Many thanks
228,Wan Carol eglit waren eleteer  Tri sogal ipi eglit meneseer  Su lapel aka sude seerondo  Wan Carol eglit ipi eglito  Sog John Steinbeck  Los Gatos in the evening  This excerpt comes from Steinbecks handwritten dedication to his first wife Carol after the publication of Grapes of Wrath I got it from my mom who is an English professor and says that there is little to no record of this dedication nor the language online Any help is appreciated  Note: Los Gatos is a town near where Steinbeck was born and had a summer ranch home
