,0
358,Ive only started reading about cryptohashing last week so please forgive and educate me on things Im misunderstanding  So lets say correct horse battery staple is hashed If a thief has a dictionary of words and knows the amount of words in the passphrase its only a matter of time before the correct phrase is figured out  My question is would it make a difference if the passphrase is actually text in a gif? That way instead of the hash being created from 28 characters its kilobytes worth of info getting hashed  I assume the thief would not be able to directly test passphrase hashes  they would have run each passphrase through the algorithm used to produce GIFs and test the GIF Would that slow them down any significant amount?
359,Ive been trying to get my head around how some codes can be so unbreakable  namely the immense trouble we had with Enigma even after we broke it its my understanding that even though we figured out how to break the code there were days when we still werent able to decode anything from it before the cipher would reset at the beginning of the new day  I know some codes might be straight gibberish Voynich Elgar but some like the Kryptos are legit yet unbreakable  A lot of these methods of manual encryption  I dont even know if thats the right word but its what Im using to describe some chump sitting down with pen and paper and obscuring the text with letters and numbers until it looks like total gibberish as opposed to some of the other methods Ive seen that involve generating md5s and other such business  Anyway a lot of the methods Ive seen just boil down to a multilayer substitution cipher This to me seems like it should be a simple matter of pattern recognition No matter how many layers you try to bury it under youre still just substituting A for B right? So why cant we see the patterns?  I guess obviously if we knew why some codes were unbreakable we could solve them but is there any theory as to where were having trouble?  If you cant tell Im asking from a stance of total ignorance and minimal exposure If clarification is needed let me know
360,Is there a reason I should be using escdsa on my ssh keys? Are using RSA for the key generation considered insecure? Are there anything that I missed where RSA is considered insecure? backdoor weak crypto 
361,Ive been told it is a bifid cipher to solve it      This is code: TF RO PC LR SO KL XK GF PN IL RL UM PG GJ IL AF AY MU SM BL KP GG RA EA RP NI LJ     Fairly certain they keyword is LSU only other clue is top right          This is the post:  Top Right   TF RO PC LR SO KL XK GF PN IL RL UM PG GJ IL AF AY MU SM BL KP GG RA EA RP NI LJ   No Q  2013 CFBHC National Championship Team   5D T  120   Password  Do not post answer in this thread   Most of it is selfexplanatory  The 2013 CFBHC National Championship Team is LSU which is why I think that is the keyward  The answer is a password to another forum with another quest
362,There is a mystery from the game Grand Theft Auto V that the people over at rchiliadmystery and elsewhere have been trying to solve for a while involving a strange code written beneath a sign for Famous Hamburgers   [A thread on the subject can be found here]http:wwwredditcomrchiliadmysterycomments217zi3we_should_look_at_the_clues_that_we_have_famous  [The Hamburger Sign]http:oi39tinypiccom2w4wgu9jpg  The text:   JD O  19390  J6 JEFF  FIGO  0Y  I thought I would post it here at rcryptography to see if any more experienced puzzlers might want to take a crack at it :
363,Im currently working on a project which involves making attempts at breaking the fourth part of the Kryptos sculpture in the CIA headquarters I was wondering if anyone had any ideas on a specific preferably not attempted previously method I should try for solving it Im currently working on using matrix decryption The 2x2 matrices have turned up nothing so far and Im working on 3x3 matrices as well
364,Professor gave us this code for extra credit I believe it is randomly assigned letters as well as a Caesar Shift You guys might will most definitely have a better idea of whats going on here I just cant decipher it The farthest I got is to thinking the first seven letters spell Susanne? Heres what it is:  GJGEVVRNRHFYFRURUGFAEFRAHYRERNRUJGUOAHNLIR  Any help?  EDIT: A frequency test got me here:  mfmillsasheresosometiesthrsisasofmouthands  What other steps can I take to decipher this?  EDIT2: The prof revealed it is a cypher and a rail method can you guys do this within the hour? ;
365,I have been toying with something I came up with one day when I was bored in class I found out after a while that I could use it as a method of encryption The only problem with it is that the key to decrypt the information is dependent on the message itself I have been trying to find a way to use a predefined key but keep running into roadblocks Im reluctant to talk to anyone about my methods yet as I want to work a few kinks out and maybe explore my ideas more in graduate studies  How bad is having the decypher key be dependent on the message?
366,So Im experimenting again with ideas on solving ECDLP and have come across a stumbling block with doing Extended GCDs with polynomials  I have the following polynomials in x :  dx = 8x^2  60x  49  fx = x^2  2  gx = 12x^2  20x  20  Imagine if you will that Im looking for the result of a division modulus some integer thus :  dx  gx == bx modulus fx  Im trying to solve this using Extended GCD where wed be looking for :  dx  axfx = bxgx  Where ax is arbitrary and bx is the eventual quotient answer to the modular division that Im looking for  So what are the steps necessary to arrive at ax and bx ?  Any help will be greatly appreciated
367,Carl has a secret message for Bob PASS Carl gives Alice the secret message to give to Bob but Carl doesnt trust Alice who may maliciously change a letter so he gives Alice additional information 1 P 3 A W S 2 S Bob has the 1 _ 3 _ W _ 2 _ to decrypt the message and knows to not trust the information if these are tampered with What is this called?
368,Random s are critical to cryptography but how cando we verify that they are truly random? At first thought you could just take the average of a large sample However I realize this wouldnt really show if the method produces random s For example I could have a method that simply alternated between 0 and 1 The average would be 05 but the method is still predictable and the s arent random
369,Lets say I generate a particularly large set of truly random data Using something like [LavaRND]http:sourceforgenetprojectslavarnd or using similar means as those used by Randomorg  equal in size to the data I wish to encrypt If I perform a bitwise XOR between the random data and the data I wish to encrypt the result is a file which is indistinguishable from randomness  but if XORed with the original random data set results in the original message  How secure is this assuming I can obtain truly random data in the first place?
370,Ive been struggling with a cipher encoded in a base4 system for the past two days and could really use a hand  [Here]http:iimgurcom099bKm6png is a snapshot of the puzzle Its titled Even the Royal mail has its own code and the hint says Please note: four to a pair  The code is based on the Intelligent Mail Barcode but when I threw it into a IMB reader it said it was an invalid string Real IMBs are I believe only 65 characters and the three strings given are 84 84 and 12 characters respectively  Here is a transcription of the code reading left to right from top to bottom using T for the dot Track A for the upper bar Ascending D for the lower bar Descending and F for the large bar Full Note: the clue said four to a pair so Ive split it up as such although in the original puzzle it is only split after every 84th character:  >FADT ATFD AADD FDAT ATDF FDTA ADDA FADT ATFD AADD FTAD TFFT ADAD FTAD FDAT FDAT FADT FTFT FTDA DADA FDAT  >DFTA AADD FADT ATFD AADD FTAD TFFT FDTA ATFD FDAT ATDF FDTA FDAT DFAT TFFT ATFD FDTA TFFT FADT TFFT FDAT  >DTFA DTFA TTFF  I noted a couple of things here F is by far the most common first letter Out of the 45 4bit strings 21 start with F 13 with A 6 with T and 5 with D  Also a base 4 string with four digits has 256 possible values so I tried translating it into ASCII I tried all 24 possible combinations of ADF and T equaling 012 and 3 and for each translated all the base4 strings into base10 and then into ASCII but it was always gibberish so I think that route is unlikely  It struck me that even though there are 256 possible 4bit combinations with this system only 17 are expressed in the puzzle I assigned each unique 4bit sequence an arbitrary alphabetical value Here is the puzzle reprinted with that system:  >A B C D E F G A B C H I J H D D A K L M D  >N C A B C H I F B D E F D O I B F I A I D  >P P Q  A few things stood out here D FDAT in the original notation is the most frequent character appearing 7 times A B and I 5 times C and F 4 times H 3 times E and P twice and G J K L M N O and Q just once  Also the pattern A B C appears 3 times and is followed by H I twice D E F also appears twice Other than that it appears fairly random I tried running the letter sequence I came up with through several Patristocrat solvers but nothing helpful emerged  And now Im stuck The puzzle is originally part of a game called Qwyzzle and based on the complexity of its other puzzles it seems unlikely that this is anything more complex than a substitution cipher although I have not conclusively ruled that possibility out It may also be that the route Ive gone with this is totally off but based on the hint I think Im somewhere in the ballpark  The solution to the overall puzzle will likely be a word or phrase in English but there is a chance its a number  The title mentions royalty and the hint says four to a pair so I thought the solution might have to do with card games or something along those lines Ive been trying brute force attempts at the solution with poker related terms and the names of British monarchs Im just taking shots in the dark at this point Maybe theres something about the Royal mail hint I havent thought of I dont know  If anyone has any thoughts ideas or hints Id be much obliged  edit: fixed transcription error
371,Hey  Any help in deciphering this code would be very helpfulthanks guys  Any thoughts?;  30313031303031313031313031303131303031313130303130313030313031303031303130313030303131303130303130313030303031303031303130313031303130313030313130313030303130313031303130313031303131303031313130313031303130303031313031303131303130303031313030313031303131313031303130313131303130313030303130303131313130313030313131313031
372,For example RSA and ECC security is greatly weakened by Shors algorithm but various other ones such as some latticebased  codingbased cryptosystems are not  Is there something inherently difficult in the mathematical operations for quantum computers in these other schemes?  I know RSA is based on the belief that it is very difficult to factor large numbers but what are some key features about the other schemes which inhibit quantum computers from cracking them? Thanks very much for replying :
373,What I mean is this; is the ability to encrypt at the highest levels accessible to anyone with a dedicated team or single trained cryptographer or does it take a large amount of resources that only a 1st world power could easily provide?  Edit: Thank you for your help I now how a much better understanding of the big picture I do plan to do more of my own research I realize that I could have come into this better informed 
374,Imagine the following scenario: an encrypted documented needs to be decrypted only very rarely so that one decryption is allowed to take arbitrarily long   Could I use a weak password provided that I stretch it with bcryptscrypt in such a way that the stretching takes a very long time say 10 minutes 30 minutes or even one hour?  Example: a normally very weak password say 6 characters ~28 bits of entropy is stretched with scrypt with parameters tuned such that it takes one hour to perform the stretching Then a brute force attack would need ~15000 years on average to crack the password  Assuming scrypt is not broken is this method secure or is there something else that needs to be considered? 
375,I had never heard about this standard before today A conversation between my grandfather and I about how best to encrypt files transmitted via insecure means lead him to mention an application he was trying out called Encoding Decoding Free It claims to use something called Ultra 3 encryption Further investigation lead him to find that it was referring to the Ultra Encryption Standard v3 and [this paper PDF]http:wwwmecspressorgijmecsijmecsv4n7IJMECSV4N77pdf about the cipher Further digging uncovered another incarnation of the standard called UESIV presumably a revisiting of UESIII  Im no mathematical expert but I am fairly familiar with the concepts of symmetric key and asymmetric key cryptography Unfortunately Im not familiar enough to make any sense of the math they were claiming in their documentation for UESIII Im hesitant to trust anything Ive never heard of before much less something I cant find mentioned anywhere except in a few scattered PDF files on various academic hosts I was hoping that there might be someone or someones here more adept at analyzing these kinds of things than I am who might be able to advise on whether or not UESIII is something which would be a suitable alternative to a more traditional application like TrueCrypt or GnuPG for encrypting and decrypting our files  TL;DR  Im no good at high level math and was hoping someone might be able to look over the documentation found [herePDF]http:wwwmecspressorgijmecsijmecsv4n7IJMECSV4N77pdf and advise me on whether or not it seems legitimate or just snake oil
376,What is a 4 letter keyword that when used in a Vigenre cypher leaves the original message unchanged? I cant think of what it might be and I cant seem to be able to work it out using the standard cypher table
377,When I was younger I used to make codes forboredom at school  Now later Ive stumbled across one No answers in sight so I thought lets ask the reddit ppl what it could possibly mean  Shouldnt be too hard I think I think  2VBU 2VI2 USN7 NKEJ  DB2VI RYG8RME JDPK 53QY 4KZM RRJDPK3QY4KZM  I have no idea what its supposed to mean It cant be that complicated right?  right?
378,Im playing around with twisted curves and I have run into the following problem :  I have a very simple curve x^3  7 mod 43 and a twist x^3  17 mod 43 Now the first curve has 31 points and the second has 57 points This all works fine in MAGMA as the following tests demonstrate :  F1 := GF43; P1 := EllipticCurve[F1|00007];  P1;  F2 := GF43; P2 := EllipticCurve[F2|000017];  P2;  Gives 31 and 57 respectively with all points as integers mod 43  Now Im trying to lift those two curves to mod 43^2 because I read in some literature that those two lifted curves should have the same number of points ie 1767 which is the product of 31 and 57 and that there is an isomorphism between them MAGMA also bears this out :  F3 := GF4343; P3 := EllipticCurve[F3|00007];  P3;  F4 := GF4343; P4 := EllipticCurve[F4|00007];  P4;  Gives 1767 and 1767 which should be correct  However the points themselves dont seem to be integers anymore? When I try to list the points Im seeing results like :  0 : 1 : 0 1 : F21^858 : 1 1 : F21^1782 : 1 F21^2 : F21^500 : 1 F21^2 : F21^1424 : 1  Which seem to be powers of something? Furthermore even though it reports the number of points on the lifted curves as 1767 when I manually try to create the integer points I get point counts of 1333 and 2451 respectively ie 31x43 and 57x43  What am I missing? Why cant I keep these points in the field of integers? Am I declaring GF4343 incorrectly?
379,are ther any tools for testing hill cipher with just knowing matrixbecause i have seen people answering with just the cipher and the matrix lengthis ther any scripts?or websites?or tools which can crack hill ciphers
380,Could you please help me think of possible strategies for cracking a code that involves the following circumstances?   the ciphertext is only 100 chars long   a plaintext fragment 10 chars is known   the encryption method involved 2 steps Either a singleletter substitution ie Vigenre first and then a diagraph substitution ie Playfair second or vice versa  Is it possible that the plaintext fragment could help reveal the keys that were used?
381,Earlier this morning I started to play around with the idea of creating a PRNG and I was curious about how secure it would be ie: whether it could be considered cryptographically secure highly unlikely or if it would be good enough just for a noncrypto purposes The state of the number generator is a SHA1 hash which is initialized to random values taken from either devrandom or devurandom when you seed the generator you take its starting state and combine it with the unsigned integer designated as the seed When you generate numbers you take the first four [sizeofunsigned int] bytes from the state hash throw it into an unsigned integer value and thats the result but every time you generate a number you take the SHA1 hash of the current state hash plus the value just generated What could be done to improve this and how secure would it be considered as it is? Just for a note this is just for experimentations sake this isnt going to be used anywhere serious [Thar be code]http:pastieorg8390863
382,>72T2101a5 2117o11E57198 4s12412281o8790661Z152507111111111450215192y81121211182220429117611251114898185168914595158211612151391  Spaces are intentional Im trying to solve this but Im just asking for a point in the right direction
383,Given we already have tools like GPG  public key encryption for crypting Is it totally out of the question that services like hotmail and google could implement a modified scheme of their own?  I was thinking along the lines that GMail or Hotmail could host a public repo to look up the keys for your client or their webclient to encrypt the mail before it is sent Pretty sure there is a public repo for GPG keys already so this doesnt seem so crazy  Given the implementation in use at [Cloudfogger]http:wwwcloudfoggercomen namely  A keykeys are generated then encrypted using the users password which the company?client? generates at random The encrypted keys are then stored on their server for download by the user   Obviously this key generation if done server side does mean they could disclose or save an unencrypted key so youd have to trust the company Equally in this case I suspect that you could get away with generating the  decryption key on your client and uploading it preencrypted with your password   In fact I am not entirely clear on how Cloudfogger handles the multple generated decryption keys for each file whether they are generated server or client side I suspect the latter and that when you login they do not decrypt a stored key to verify your account Rather using the normal password hashing mechanisms for authentication risk of NSA intercept leakage of the password when hashing to compare though it would be pretty difficult to do so compared to decrypting a single key unless its for a single simple verification file  More details on Cloudfogger [here]http:supportcloudfoggercomindexphp?KnowledgebaseArticleView137whattypeofencryptiondoescloudfoggeruse  A service like Google could host both keys If technically possible decryption can be done client side then they have no access to the email nor can they decrypt anything that is sent recieved  Depending on implementation they could display via the server with a cached decryption key which is more risky but also more convenient and transparent to a user Or send all crypted information including emails to the client For server side it would preserve hotmail and googles ability to serve targetted adverts  Again issues are presented by a server side service as the cached decryption key could be subject to an NSA intercept or a security compromise of some sort  To me this doesnt sound like an impossibility or even that difficult as a project if done server side Client side however would present more challenges but I believe given the revelations about the NSA and GCHQ Totally worth it  Opinions? I tried finding a GoogleDev but theyre surprisingly elusive  ps Im trying to find a better PDF file that explained Cloudfogger but no luck so far This also might be unclear or a bit crazy had surgery with general anesthetic today
384,Hi All  I am trying to make my own encoding function to get a better understanding of how encoding works I am encoding ASCII text to a base89 random alphabet I generated I would like to then reencode that to a base55 alphabet that is my base89 alphabet from [054]   Much like hex to octal I think this is possible My question is: how do I account for the overflow encoding characters being the same as those that arent overflowed? Example: base55[2] is j but if i encode something that has value 57 and its modded it goes to base55[2]  Here is the link to my python code: http:pastebincomKJPz5Fpg  Thank you
385,Crypto noob here so bear with me  I am analyzing HTML requests of a game called Clash of Clans in which the content field is encrypted using an algorithm that looks easy to understand Ive uploaded a couple of samples of just the content field [here]http:wwwmediafirecom?7wwmfzx175u2p2u2Civ2p7p8sb94sqrh View in hex editor  There are several sections of raw data that are repeated across all requests like this hex sequence 09 02 0B 00 10 and content is not fixed in length So it cannot be a block cipher? am I correct in assuming this?  And all the requests start with similar sequence with a byte changed here and there If anyone needs more samples andor the complete HTML request Id be happy to upload You can also find me in Cryptocat room r_cryptography
386,Ive figured out to encrypt messages using the VIC cipher thanks to [this amazing site]http:wwwquadibloccomcryptopp1324htm but I cant find anything on how to decrypt   Can anybody help? Thanks in advance
387,Ive recently been wrapping my mind around the US militarys [DRYAD]https:enwikipediaorgwikiDRYAD cipher which I understand to be a [polyalphabetic cipher]https:enwikipediaorgwikiPolyalphabetic_cipher  As the code currently stands where every message is substituted for the letters in a randomly sorted alphabet I can understand why this is insecure For example if the alphabet used was:      ABCDEFGHIJKLMNOPQRSTUVWXYZ     ZPKULANQDYEGCSXMOIHTRVBJFW  So if I wanted to say FLEE Id say AGLL This understandably can be reverse engineered since the structure of the word is still intact just with different letters So far so good  However; what would happen if every letter of the ciphertext was substituted with a letter from a different randomlyshuffled alphabet? In this case; 26 different alphabets each titled A B C and so forth  For example after converting our F in FLEE to an A we would grab the letter one character to the right in this case N Using N we would go to that associated alphabet:          ABCDEFGHIJKLMNOPQRSTUVWXYZ     N = FXJHODYSGZERKBILUWCTPQAVMN  Next we would take our next letter in our message L and encode it from L to R Following the above pattern wed grab the letter one character to the right K and go to the K alphabet and so on  Why is this insecure? How would it be cracked? I try to conceptualize how I would break it but the number of possibilities hurts my head
388,I was reading some stuff about it on the wiki and some of it concerned me Do you think its safe?
