,0
0,The news is [here]http:wwwguardiancoukworldvideo2012nov02carrierpigeoncodedmessagevideo   The text is reproduced below    AOAKN HVPKD FNFJU YIDDC  RQXSR DJHFP GOVFN MIAPX  PABUZ WYYNP CMPNW HJRZH  NLXKG NENKK ONOIB AKEEQ  UAGTA RBQRH DJOFM TPZEH  LKXGH RGGHT JRZCQ FNKTQ  KLDTS GQIRU AOAKN 27 15256   NURP 40TW 194  NURP 37DK 76  I say someone go try some ciphers  
1,[Link to press release]http:wwwmojangcom201211minecrafthassold8millioncopiesonpc  Notchs comment:  >Notch replied with this: 69I960EHE0A4A0IVG0EHE02500R4R0G1T30PLJ00V6V0EHE0V1U01V10U5U0VGV0V4R  The folks at rminecraft have been digging into it but no one has made much headway [Heres]http:wwwredditcomrMinecraftcomments1328zyminecraft_has_sold_8_million_copies_on_pc the discussion thread is anyone wants to see what theyve come up with so far  edit: spelling
2,KVNGR REV ALPHA PPS VT PIZ UHMYLPVOQ CM XHWMZP NBJB SPIF BYQS QT DY BYFGEOB FI VQDYL MAQ NGQHT 5120 Nuclear winter has come  Thank all of you guys here it has now been solved THE INSTITUTE IS SEALED THEY WONT HELP US IM HEADING TO BLACK ROW TBNLS
3,I found a book in my garage full of cryptography puzzles Im not sure if there is a subreddit for it already or not but I would be happy to support the community and supply a daily puzzle for a while if there is interest Thanks  edit: Ok sounds like there is some interest in this Ill post the first one tomorrow Although it might sound obvious please dont just google or stick the puzzle into an online solver The first ones will be a little easier as well to introduce how to think like a cryptographer or spy as the book puts it
4,I received [this letter]http:iimgurcomvj5P9jpg a couple of days ago and its been driving me nuts Someone on rpics suggested that you might be interested so here it is Ive had a go at deciphering it assuming it IS a cipher but my very limited skills in this area have got me nowhere Any thoughts on the text would be appreciated   >EXPQI UKESV GHXZZ OXRCP FJERY ORYIB ASJQP KQBNW ULAWF NZIVR DDGTX DUCXA RMJRO CWINI GYDXM SIYQI VVFMQ YRKBF OPYAG YUMLZ BBFMB GKGGN PODYT LELLV ROKZV  >GVOHF KLWKO IYSIZ NKWSZ JNMGW VHHHV KTLOA YFPRR HMEQD XQFOU YYRIS HBKLN PDNQZ ALOCX LNTTY YZQAO BTVIP FFZTF XLHZZ TKNED NLJPP ORZLX DRLBF WRIOA RLHWM CMESL MLXVN CZYPE BIELV CODDN RNDBU TUICU BJKFG TZEKC YQHGE WBZCN  >LHWNE TQVNN YWLAA DCDZH FKBPQ EBILB WLSRB IGUVV JDQTF EIJRZ RCFDP FBOHA ZCBYM LANAO CWTCD XTMMF ZQVNO NRBKY
5,This subreddit has an awful lot of posts where the poster posts some random code with no other content than solve this for me please  This is not cryptography and therefore it does not belong on this subreddit I will remove all posts which doesnt contain content that is related to actual cryptography  If you really want someone to break your code you can use rbreakmycode or make your own new subreddit  Thank you for your understanding  Edit: The sidebar has been updated
6,Some years ago I took a class on Cryptography and decided With the professor permission to write a introductory course based on the exercises we solved on that course I started publishing it to my blog here are the first two:   [Mathematical basis I  Modular Aritmethic]https:elbauldelprogramadorcomencryptography101mathbasisi  [Mathematical Basis II  Modular exponentiation]https:elbauldelprogramadorcomencryptography101modularexponentiation  I would like some feedback from you My idea is first cover the basis mathematical background needed to be able to explain all the exercises on my [elbaulpcrypto]https:githubcomelbaulpgrado_informatica_criptografia github repo  Thanks
7,I was looking through my keys published on the MIT PGP keyserver the other day and stumbled across something very interesting I have a 1024 bit DSA key that I generated in 2007 and have used to this day Yes I know its weak and Im slowly replacing it with a smartcardbacked key  But there was another key on there  [an RSA key whose fingerprint matches the last eight digits of my DSA key]http:pgpmitedupkslookup?search=0x40FD6D2Eop=index Signed by people that have signed my key The key has been revoked  Then I looked closer The keys of the people that signed the unauthorized key have also been revoked:   [Greg Jurman]http:pgpmitedupkslookup?op=vindexsearch=0x19489CD1B2370F0C  [Matt Soucy]http:pgpmitedupkslookup?op=vindexsearch=0x19489CD1B2370F0C  And so have the keys of their signers:   [Grant Cohoe]http:pgpmitedupkslookup?op=vindexsearch=0xB920E74B3CA11D3D  [Ross Delinger]http:pgpmitedupkslookup?op=vindexsearch=0xA2A146DD9301F397  Note that these are all people I know IRL have met and trust And these are not their real keys In all cases above if you look at the two keys the secondtolast 8 digits of the fingerprint DO NOT match:   Me: [Real key]http:pgpmitedupkslookup?op=getsearch=0x6E715AF940FD6D2E [fake key]http:pgpmitedupkslookup?op=getsearch=0x4891DAE140FD6D2E  Greg Jurman: [Real key]http:pgpmitedupkslookup?op=getsearch=0xB1EE16A6B641F4DE [fake key]http:pgpmitedupkslookup?op=getsearch=0xF2671D30B641F4DE  Matt Soucy: [Real key]http:pgpmitedupkslookup?op=getsearch=0x7996734FB2370F0C [fake key]http:pgpmitedupkslookup?op=getsearch=0x19489CD1B2370F0C  Grant Cohoe: [Real key]http:pgpmitedupkslookup?op=getsearch=0xCE38D9963CA11D3D [fake key]http:pgpmitedupkslookup?op=getsearch=0xB920E74B3CA11D3D  Ross Delinger: [Real key]http:pgpmitedupkslookup?op=getsearch=0x65ACC3899301F397 [fake key]http:pgpmitedupkslookup?op=getsearch=0xA2A146DD9301F397  So what the hell happened here? The more I look into this the more it looks like someone has conducted a large scale attack of sorts on the PGP web of trust by creating a duplicate WoT with the same UIDs and last eight digits of the key fingerprints as the real WoT This would be very easy to do if you downloaded the entire WoT and generated enough keys to cover the entire space of 8 digit fingerprints for 1024 2048 and 4096 bits Thats only 3\232 keys in total or about 12 billion keys Relatively trivial on modern hardware It would make for a great social engineering attack since a lot of people simply look at the last eight digits It smells like an academic research project and the revocation following the successful experiment confirms that whoever performed this attack did not want the keys to be useful to an attacker if they fell into the wrong hands  Of course this is a simplistic attack No private keys are compromised this is essentially just a partial hash collision This was clearly intentional My question is  does anyone here know who did this? Why? Ive been Googling around for the last week and cant find anything about it
8,I meant to post this earlier but I slept in This one is relatively easy I think Its up to the community if you would like to post the answer when you get it or wait for others to solve it   Title: corrruptive campaign   C2 a1 d4 D4 C3 c4 d4 a5 d3 a1 D2 A5 C4 c3 d4 C4 c5 b1 c1 c4 C4 d2 c4 B1 d3 A3 B4 A5 C3 A3 a5 A2 C1 C4 a3 b5 B4 c3 c1 c4 a3 b5 a5 d2 C4 c3 d3 a5 a3 C4 c3 a4 d2 C4 e2 a4 c4 e2 c3 A1 c3 a4 d4 b3 b4 D2 A4 B1 d2 c4 c2 d2 b4 b2 b3 D4   b1 d2 c4 c2 D3 B4 C2 C4 C3  Edit: Anyone can PM me with the solution Hint is in comment section Edit 3: First person to PM the solution was: kathyayani Kathyayani will post how to solve it later in the day
9,I know this is a long shot but its worth a try  It seems like this may be the best subreddit to post this to  My brother committed suicide about a year ago  He had given me a thumb drive with a truecrypt container given to me about 9 months before he passed which has his bitcoin wallet  He gave it to me in case of emergency for his use  He did not share the password with me to decrypt  After his death my parents unveiled a second thumb drive that he gave to them along with a password  It was given to them a few months after he gave one to me  The problem is the password did not work invalid password or not a truecrypt container  I cant imagine him giving my parents a password that wouldnt work  Perhaps the containers headers are corrupt?  Im not sure what my options are  Ive looked at truecrack but knowing my brother he would not have used a simple passphrase  To give you an idea he used a 30 character phrase with the drive he gave to my parents alphanumeric wspecial chars  I know there is a substantial amount of bitcoin especially at todays market value well over 100 coins  He had invested tens of thousands when it was around 100  He did extract his initial investment when it was hovering around 4600  Any and all advice is welcome  Im trying to find a direction  The amount of money in that wallet would be life altering for me and my family  Every time I see a post on Reddit about the current market value of BTC I feel sick to my stomach  Ive tried to keep blinders on  Avoid readinghearing anything related cryptocurrency because of it  Ive had family members occasionally texttalk to me about it to which I dont reply  I attempted using truecrack on the container that he had given to my parents in the event that he didnt give them the right password  I ran it for a couple of weeks before I gave up  I have not yet attempted on the drive he gave to me mainly because I only recently found it when going through some boxes  I know that if the thumbdrive he gave to my parents is corrupt theres really nothing that can be done  Although Im not sure if im missing something   However if there is a way to crack the drive he gave me its highly likely that all of the info to access his wallet is in there  Again I know its a long shot but Id like to get some honest feedback and advice    Thanks in advance
10,Could someone point me in the direction of a good tool or course to learn cryptography?
11,Let me know
12,This [course ]https:wwwcourseraorglearncrypto2has been postponed since 2012 Will it happen this time ?
13,Preamble  I hope this is the right sub for a technical question about the handshake being exploited ; the major subs and rkrack seem mainly focused on layman or pseudolayman explanations and mitigation of the problem  The most technical writeup I could find so far is [this]https:blogcryptographyengineeringcom20171016fallingthroughthekracks which describes the problem as Step 3 of the 4Way Handshake being blocked causing a retransmit of Step 3 and therefore a reuse of counterkey in a stream cipher by the STA   However that is not possible  if Step 3 was blocked the STA would never have gotten the key and counter in the first place  I assume the article means Step 4 is blocked so that the STA considers itself to be fully authenticated but the AP has not yet received the ACK  Im quoting 80211i2004pdf section 8535:  > 8535 4Way Handshake implementation considerations > > If the Authenticator does not receive a reply to its messages it shall attempt `dottRSNAConfigPairwiseUpdateCount` transmits of the message plus a final timeout The retransmit timeout value shall be 100 ms for the first timeout half the listen interval for the second timeout and the listen interval for subsequent timeouts If there is no listen interval then 100 ms shall be used for all timeout values  If it still has not received a response after these retries then the Authenticator should deauthenticate the STA  The document does not define or discuss listen interval or dottRSNACOnfigPairseUpdateCount anywhere so Im assuming it would typically be on the order of 100ms interval and some handful of retransmits  Now: if the AP has not received the ACK then the AP obviously should reject any traffic received from the STA and deauthenticate it    So it seems to me that the problem would be limited to requests sent by the STA in that window after receiving the Step 3 message  But since such messages are not getting responses from the world Id expect itd be limited to a small number of packets  the majority of applications would have sent a request and be waiting for response  Of course having hold of even a small number of packets with repeated counterkey means the content of those particular packets can be partially or fully decrypted  with MITM happening for only those packets if the attacker does let the Step 4 ACK through later  However this should mean that any packets generated more than about 1 second or whatever `dottRSNAConfigPairWiseUpdateCount  ListenInterval` works out to are still fully protected    So the scope of the attack would primarily be capture of packets during that window and decryption at a later time ie a loss of privacy; which is further limited by the fact that since no responses are ever received during the attack period the single requests from each application may not have happened to have sensitive data  It seems difficult or next to impossible that software could  in real time deduce the complete and exact pad for a given nonce from just a small number of reuses and then modify a packet instream? Ie maninthemiddle seems impractical here  Is my understanding all correct here?  NB Of course the Android 60 bug where an allbitszero key is installed in both devices is appalling and doesnt need further discussion 
14,I was wondering if you guys knew of any websitestoolsresources I could use to learn some of the basics of cryptography maybe some stuff that could let me practice my programming as well Im good with Python and Java and a bit of html and javascript   Anything would be cool really
15,I tried to ask him but it only seemed to make him angry Can you help me Reddit ?  Link to the Pictures: http:imgurcomaa9BBf
16,   I guess most of you have already heard about this scam project with enormous claims  Credits Blockchain Platform I want to give you an objective review of this project I dont deny that I am a holder and will try to explain exact reasons why this coin has good potential in my opinion   I advice people who still have doubts to follow their social media and check how platform is working you can do it right now Developers provide software updates every 2 weeks and currently they have Testnet 22 version They already have a working product with capability to send transactions deploy smart contracts and develop decentralized applications   [Download Testnet 22 for Windows and Linux]https:developerscreditscomenArticles11  [Test Web Wallet]http:walletcreditscom  [Check Blockchain Explorer]https:monitorcreditscomr2  Why Credits is the first platform to get mass adoption?   Unique technological features  01 second transaction processing time 0001 USD transaction fee network capacity more than 1 million transactions per second;  Smart contracts are written in Java  the most widespread programming language in the world it is Turing complete In comparison with EOS where smart contracts are written in C it is much easier for devs to create solutions Moreover nonblockchain devs will have an opportunity to create a smart contract on platform without learning new programming language for example like Solidity on Ethereum;  Apache Thrift technology helps to connect  every programming language to Credits blockchain In comparison with EOS where WebAssembly is used it provides wider opportunities for programers to develop web interfaces using C C Delphi Gol Java OCaml Perl PHP Python Ruby JavaScript and many others;  Opportunity to create decentralized applications operating with the objects in real time mode Platform allows to deploy decentralized applications of any complexity Discreteness of the smart contract code execution is minimized due to instantaneous block formation time 5 blocks per second;  Advanced features of smart contracts  cycles and schedules allows to execute smart contracts according to a predetermined schedule at the defined time This feature implemented with the help of blockchain technology is important for various spheres such including Internet of things insurance financial industry and gambling due to possibility of business processes automation  Moreover I had the opportunity of personal communication with technical specialists of the company Each of the employees is motivated by the result; this is a team of professionals with their own philosophy of the future in which the project plays the role of a switch that connects all the ways leading to the massive use of the CREDITS platform in various application areas with unique business models developed by the project management Seeing a clear understanding of what the team is doing and how they see themselves in the future I realized that CREDITS is supposedly called upon by the Universe to fulfill the most important mission on the cryptocurrency market and the blockchain   to solve scalability problem Credits is a solution Credits is the future Credits is your choice
17,I have recently taken up interest in cryptography because of cryptocurrencies like Bitcoin and Ethereum I unfortunately do not currently have access to college so without college how should I go about studying the field 
18,@356sdfH3y43 2@a@VZQ0sa002Q@21 @2332456@0940a WN0TU@0293422a2039   taken from this [pic]http:playstarboundcomwpcontentuploads201302102939201png for this [game]http:wwwplaystarboundcom
19,But its locked in a RAR file on it Password is not known it was a police auction from a online drug seller   Ive used RAR2JOHN to extract the hash: rar516249fde725d3fcb699d3b16c21a8fd56e154c4d8eedb8c2eafeed907bbbde59f8058f278d763dffbef33  and am trying to crack the hash using Hashcat on a dedicated machine I have Its been whirring away for a while  I think a bounty is worth it now Something along the lines of if you help me crack this and get into the wallet it contains i will share a percentage of the value of the wallet? Anyone fancy a challenge? PM me if you fancy it  Edited to say that I have downloaded LOTS of password dumps from all the major breaches and thrown them all at it with no joy Which is why ive resorted to the hash  and even then i suspect its a longrandom stringThanks to those who messaged me
20,Im curious as to what online resources are available and if theyre reliable  Also whats everyones opinion on the Applied Cryptography book by Bruce Schneier?
21,I have zero knowledge of cryptography so forgive my naivete Let me try and explain what I mean:  Say hypothetically someone handed you a piece of paper with a string of numbers and letters on it and told you it was a code with a secret message At first glance the writing on the paper appears totally random and at this point you only have that persons word that theres a code there at all Is there any way that you can prove whether or not theres really a code there that would be quicker andor easier than trying to solve it so that you wont end up wasting hours trying to decipher a page of random gibberish?
22,Hello Sorry for not posting one yesterday Im trying to get my cameraphone camera working so I can upload one that does not start with lettersnumbers but symbols for more of a challenge Until then here is another one  381 282 e 223 64 l 85 386 e 247 368 a 169 61 502 43 384 e l 405 l 66 07 468 409 121 o e 242 a 403 a
23,Weve launched a project today on unnamed crowdfunding platform and just wanted to give everyone the heads up that for the first time ever weve hidden a pretty tough code on the page thats been inspired by the reallife work of one FBI examiner we know who cracked it in 4 hours   All cryptanalysts arm chair detectives and generally inquisitive people unite to crackitandbackit Wed love to hear from you on Twitter to see what you think the answer is   caseforensicoutreachcom  Good luck
24,Lets say the computer is sporting an [Intel Core i75960X]http:arkintelcomproducts82930IntelCorei75960XProcessorExtremeEdition20MCacheupto3_50GHz  with 64GB DDR4 3100 Ram just curious here not even sure if modern computers could work with the enigma code 
25,i saw this subreddit wwwredditcomrA858DE45F56D9BC9 all the post look like some kind of code so my question Do any of you have a clue what its about?
26,http:wwwbbccouknewsuk20749632
27,Introduction  Hello cryptography A few months ago I first became interested in encryption and I remember how confusing and conflicting the resources teaching algorithms like AES appeared to be without knowing the fundamentals So for those of you who are interested and have some modest programming experience I present to you a guide on learning AES:  The Math  In order to understand a lot of the code youll need to first understand the math behind it Avi Kak has a wonderful set of lectures on modular arithmetic which ends in an explanation of exactly how that math relates back to AES   [Start Here]https:engineeringpurdueedukakcompsecNewLecturesLecture4pdf   [Continue Here]https:engineeringpurdueedukakcompsecNewLecturesLecture5pdf   [Continue Here]https:engineeringpurdueedukakcompsecNewLecturesLecture6pdf   [Continue Here]https:engineeringpurdueedukakcompsecNewLecturesLecture7pdf   [Conclude Here]https:engineeringpurdueedukakcompsecNewLecturesLecture8pdf  The Flow  Before you get into the specifics take a moment to view and study [this]http:wwwcsbcedu~straubincs38105blockciphersrijndael_ingles2004swf animation It very clearly illustrates the concepts and flow of Rjindeal Maybe with some idea of what you are actually doing the code snippets you read will make more sense  The Specifics  Now that youve got a pretty solid background in the overview of the algorithm and mathematics it depends on its time to jump into the specification In my opinion the most coherent one was the [official one]http:csrcnistgovpublicationsfipsfips197fips197pdf published by the NIST For the equivalent inverse cipher variation of AES intel offers documentation [here]http:softwareintelcomsitesdefaultfilesm619d617973aesinstructionsset_wppdf  Examples  Brandon Sterne offers his well documented implementation in Python 27 online and I found it to be extremely useful That can be found [here]http:brandonsternefamilynetposts200706aestutorialpythonimplementation If youre not familiar with python I published an Ada program recently with a documented implementation of both AES and SHA SHA or some other hash algorithm is required if you intend to take a password and use it as an encryption key That can be found [here]https:sourceforgenetprojectscryptfilefiles Cryptfilezip contains all of the source code and a gps project I know people are less likely to be familiar with Ada but given how english like it is if youre not familiar with either Id opt for the Ada implementation  Ending Notes  Learning this was an adventure for me but I found it very exciting and rewarding and I hope you will too If you have any questions feel free to post here and I will try to help or find documentation which will By no means am I an expert or even qualified to answer analytical questions about it but if youre new and just learning to implement it I can probably offer some help Good luck and happy encryption
28,[https:wwwcourseraorgcoursecrypto]https:wwwcourseraorgcoursecrypto  The class started two weeks ago but theres still time to register and submit the first assignments by Monday 917 Im enrolled in the class and learning a ton its great
29,My personal favorite pen and paper cypher is the VIC cypher Whats yours?
30,Whats the best way to get into cryptography as a high school student? Any good textbooks? Maybe a video series? Any math that I wouldnt know that I need to?
31,Whats a good cryptography book that really teaches you cryptography? Also does anyone know where to buy the original version of codes and ciphers by Alexander DAgapeyeff? 
32,Hi all i am a senior in highschool currently taking Calculus 3 Ive become really interested in cryptography lately it seems like a part of computer science that i would really be interested in Really my question to you guys is What books do you recommend for a beginner like me? Any tools you guys think might be helpful towards my learning in cryptography? Any advice?
33,Im trying to get into cryptography but I have a hard time understanding HMAC  Why should I use HMAC ? I mean I need a key which has to be private right? so why cant I just use AES as example to sign my message ?  
34,Hello cryptography Id like to bring to your attention a basically new subreddit focusing specifically on Steganography For those of you who dont know what that is it is a cryptography practice which not only encrypts data but also disguises it as other data For example using the LSB of color vectors in a picture to store information If youd like to know more here is the wikipedia article: http:enwikipediaorgwikiSteganography   The subreddit exists because of the differences as much of steganography wouldnt be relevant to the cryptography reddit I welcome all of you to join us  http:wwwredditcomrSteganography
35,Im interested in computers and cryptography but I can neither program nor have I any clue about cryptography Can you guys give me tipps how to get started?
36,Low security margins promotion by the same guy as DUAL\_EC suspicious behavior and refusal to cooperate:  [https:wwwspinicsnetlistslinux\cryptomsg33291html]https:wwwspinicsnetlistslinuxcryptomsg33291html
37,Hello cryptography Id like to bring to your attention a relatively small subreddit focusing specifically on Steganography For those of you who dont know what that is it is a cryptography practice which not only encrypts data but also disguises it as other data For example using the LSB of color vectors in a picture to store information If youd like to know more here is the wikipedia article:http:enwikipediaorgwikiSteganography  The subreddit exists because of the differences as much of steganography wouldnt be relevant to the cryptography reddit I welcome all of you to join us  rSteganography  
