,0
113,Im working on a project involving cryptanalysis of a symmetric encryption algorithm will post details if requested and I need to figure out which methods are applicable I found some research papers on the topic but theyre completely indecipherable to me isnt that ironic  or perhaps exactly what youd expect? One of the methods we are considering is using an integral attack but Im not quite clear on how this functions The wikipedia article is the only explanation Ive found in laymens terms and its missing a couple details that are necessary to actually perform one on a particular cipher  Note this is for a high school science fair project so Im not exactly doing cutting edge research here I also need things explained in a way that a firstyear calculus student can understand :V  Thanks
114,I just got a Twitter bot up and running but now Im wondering why I need so many keys and tokens in my code   TwitterAPIconsumer_key consumer_secret access_token_key access_token_secret  These four codes are 22 42 50 and 45 alphanumeric characters  Id have thought that my Twitter account name and a 20 character alphanumeric would be more than enough Is there some crypto logic here or is it just a weird programming decision?
115,I tried to sign up for an account with a VPN provider tonight pro xpn the signup form rejected my chosen password because it was too long I had picked 20 characters and it thought 12 should be the maximum   I was under the impression that is you properly salt the actual length of the password should be irrelevant should I take this to mean they are not properly securing their database? 
116,Im new to encryption but have always been fascinated by it That said Ive come up with an idea for encryption that could encrypt anything into superficially reallooking text  Ive coded the encryption side but not the reallooking text side due to time constraints Weve just had our third baby :D   Im just wondering how much interest there is in this sort of thing and if I were to post the details once I get everything sorted out what format people would prefer to see it in  Ie Source code on git hub examples algorithms pseudo code etc   Let me know what you think and Ill try to make some more time to get this finished  Thanks for reading
117,Ive got an SD card Im using to store my Bitcoin wallet on and I cant get it to mount It seems the only possibility is that I somehow manged to mistype my password twice Is there any way that I can brute force the volume based on the password I meant to type trying alternative capitalizations characters in a switched order helloworld > ehlloworld hleloworld helolworld hellwoorld hellowrold etc or anything else like that?
118,Im an undergrad working as a student programmer for the cryptology research group on campus  My bosses are all PhDs and the fewer questions I ask and the more I figure out on my own the longer Ill probably be able to keep my job  One of my bosses there and his grad students do a lot with matrices and linear algebra  Im trying to teach myself linear algebra now but I would really like to know just a basic idea of what theyre doing so that I can best support it when Im writing code or debugging their code  So this may be a broad question but what is used for some basic examples would be awesome  I know some of it has to do with lattices I just know the word Im trying to understand what that is and subspaces kind of understand this is a subset of a domain of the plane R^n but still shaky
119,Are there any tools for basic cryptography analysis and attempt various attacks?  I imagine a field where you can paste or load the encrypted text  A possibility of trying out a bunch of pre configured solutions and the ability to add new algorithms and test them  and of course  a field that shows the result of a transformation   I can write specific apps for each but I would love to have a tool like above
120,Would any of you cryptography masters be willing to lend a hand in solving a numberstationesque puzzle from one of the worlds finest electronic musicians? Seek out the 6s puzzle @ rboardsofcanada We need help
121,The woman who had my job before me left [this document]https:docsgooglecomdocumentd185Xbb9wcFX39sMe9LrYdmyQAqda6qoqWy7A3tDkYSMedit?usp=sharing on the desktop of her computer entitled CODE  She left lots of other strange writing and stories and Im interested to know what this might say  Any help decoding it would be greatly appreciated thanks  
122,We were given this today as a hint to this years FIRST robotics game Full text below: this could literally be anythingor nothing   Game Hint 3  31 88274153 622341415326  412383975388 9788533197  31 262383835388 332341415326  93276426238397 995323979397
123,Hello again Reddit  I recently posted [here]http:wwwredditcomrcryptographycomments14jxkhwould_anyone_mind_trying_to_crack_my_algorithm_id to request some insight into whether or not my algorithm could have any sort of reverse engineering provided on it Its deleted so that Im not spamming the forum but you should be able to access it by the link  Ive updated the algorithm and posted it [here on pastebin]http:pastebincomw6tck25C The algorithm is written in PHP since the site Im developing it for is PHP  To see if this algorithm is as secure as I believe it to be Im posting the algorithm itself as well as two challenges In the primary challenge there are 50 ciphers provided each of which says the exact same thing and uses the exact same salt Tell me what the message says You can find that challenge [on this pastebin]http:pastebincomVkpMFGYp  The second challenge gives you more information It provides you with the text used to generate the cipher and expects you to identify the salt that was used This challenge provides 250 codes to crack and the salt used is identical for all 250 codes  You can find that challenge [on this pastebin]http:pastebincomNWbucxv1  About this Algorithm: Note: same text as in the first link  This algorithm is designed to be impenetrable not because of the time it takes to force through it but instead because of the uncertainty when trying to decipher it When the algorithm creates the cipher it encodes it with a completely random minisalt that pads each character in the content  This minisalt is passed along with the code which would enable it to be deciphered at the other end However the private salt is then padded over the public salt with the purpose of eliminating any certainty when attempting to reverse engineer the cipher   A cipher is never consistent when encoded but rather can be a variety of trillions of different possible codes Even the creator of the original cipher cant know or predict how the algorithm will generate the final result This means that a code created a million times may be different each time and the corresponding decryption will be split into even further possibilities Though every possibility can be unpadded there is no certainty once its unpadded   Considering the following ciphers that have been created:    Hello How are you? ::: `0k2tJ8d^sU6\bk6M>]}PmZVB  Hello How are you? ::: 0}lRQ2dL\`nJyC]jFR8Qfd{O64J9wYm  Hello How are you? ::: ZCSArfQ5x[h;IEVmRN}kz8zmZ}P  Hello How are you? :::  ;`CvOEkD}}6Y9eY9QlWHKRd8U8kF  Hello How are you? ::: M?sbVy[Lqiakj\ tr~h@lG{uzrqASe{  Hello How are you? ::: ;QASb{mEllD>F?T^>\UcB^Zvx~LcMtK  Hello How are you? ::: <1<TJ]Fq[]>Zve0{~FGlcraYDU19NO   Each of the ciphers above begins with Hello How are you? and each uses the private salt jV30L[DS?dCs Yet despite these consistencies each cipher was generated into a different result This lack of consistency is the core principle in the algorithm To reverseengineer the cipher you need the public minisalt provided in these keys which is currently padded after having affected the ciphers afterward   As always if the reverse engineer knows the private salt he can reverse the cipher
124,Hello fellow redditors  Let me first say that Im not a cryptographer Im just a programmer However Ive had an idea for cryptography since I was in 10th grade that convinced me that I could create a secure cipher But every time I read anything on cryptography everyone always says Dont use your own cipher it will be insecure and youre a fool  I can see how that might be the case for many ciphers but Id be honestly shocked if the cipher I designed falls into that category I know thats a bold claim considering theres actually professionals in the field that understand all of this stuff but perhaps due to my lack of experience in the field Im honestly baffled how anyone could get through this  As of yesterday I have finally had a potential use for twoway encryption for my site so I finally decided to make an insecure prototype of the algorithm So Id like to put my theoretical claim to the test Saying its secure is one thing  actually being able to stand up to people who know what theyre doing is another  So I created a database dump of 250 twoway nonsalted ciphers The text used to generate the ciphers is included as well as the cipher itself General details about how the cipher works is also included  Is there anyone here who can even do some degree of reverse engineering on this? Heres a final cipher without text provided:  |g4AuWIX1siQXA6~yp1h}4mddQ[{97U`v[rX3zAdl;amp;\S4  And heres the dump of text on PasteBin: [Ciphers]http:pastebincompat3D7wK  If anyone needs more text dumps or has testing questions let me know I can provide more if necessary
125,|:||:||::||:|:|:::| |:|:|:|::|::| |:|:|::|:| |:|:| |:|| ||::|::|:|:|:| |:|:|::| |||:|::|:::|:||::| ||| |:|:|:|:|:::||:|:| |::|||:::| ||| |:|::|:|:| |::|::|::| ||:|| |:|:||::|  ||:|||:|:|:| |:|:|::|:| ||:|:|:|::::|||::| ||::|:::| ||:||:::|:|:| ||| |||:|:|::||:| ||:::|::|:::|::|:|::|  |:|:|:|:::|||::| ||:|:|::|:|:|:|::| |:|::||:::|||:|:::|::|:| ||:|   ||:| |:|:|::| ||:| ||:| ||:||::|| ||::|::|:|| ||:|:|::|::::||:| ||:|:|:| |:|::|| |::|:|::| |||:|::|::|:|:| |:|:| |:|:|:|::||::||::|:|:|::::|::|:::| ||:::|:|:| ||:|:|::| ||::|:::| ||:||:|:||:|:::|:| |:|:| |::|::|:|::| || |||:|:| ||:|:|:| |:|| ||:|:|:|  |::|:| |:|:| |:|:|:| |||:|:| |||:|:||| |:|:|:| ||::|:|:|::||::|:::||::| |::|:|:|::|| ||:|:|| ||:|::|:| |:|:| |:|:|::| |:|| ||:|:||:|:|:| |:|:|::|:::| ||:|:::| ||:::||:| || ::|:|:| |:|::|::|::| || |:|:|:|::||::|:||:|::|:::| |:|:|::| |:|:|:|:|:::| ||::|:::|   |||::|:| |:|:| |:|:|:|::|:| |||:|::|:::|::| |:|:| |:|:||| ||:|:|:::| |:|:|::|::| |:| |::|:|:|::|::||:|:::||::| |:|:|::|:| ||:|:|:::|:|:| |::|::|:|::| ||:::|::|:::|::|:|::| |:|||::|   ||| ||:| ||||:|::|| ||| ||::|:|:::|::| |||| |:|:|  ||::|:::| ||| |:||:|:| ||:||:::|:|::| |:|:|::|:::| |:|::|::|:|::| |||:|::|::|:|::|:::| |::|::|||::||:||:|:| |:||:|::| ||::|:::| ||:||:|::|:|:|:::|:|:| |::|:|:|::|::|| |:|:| ||:|:|:::| |:|:|:|::| |:|:|| |:|||| |:|:| ||:|:|:::| |:|:|:|:| |:|:|| |:|||| |::|::|::|::| || |::|::|:|:|:|
126,Hey guys Ive recently gotten into cryptography but obviously only the very basics Im talking about things like Bifid Cipher and Playfair Cipher  Are there any good books that start from the very beginning of cryptography and go slowly further into more advanced techniques?  EDIT: After digging Amazon I found a book called The Code Book anyone recommends it?
127,Hello   I have watched the movie Imitation Game multiple times and still couldnt understand how Alan had a click from the German weather forecast at 0600 daily? Please explain 
128,I read recently that the Riemann hypothesis may be proved [link]https:wwwnewsweekcomriemannhypothesismilliondollarmathmysterymichaelatiyah1146244 While it has not been peer reviewed yet the author of the proof has an impressive resume  I have read before that proving it would be disastrous for cryptography but how? There are already other branches of mathematics that have proofs that start by assuming the Riemann hypothesis is true If having it would make prime factorization faster why cant we just assume it is true and know that it may fail every now and then?
129,hi Everyone please correct me if im wrong for my understanding for the man in the middle attack used in a variant of diffie hellman key exchange   am i right to say that a protocol is susceptible to the man in the middle attack if each participants is having their own private key of yP and public key of g\^yP mod p and   A > B : g\^rA mod P  B > A : g\^rB mod P  x200B;  rA and rB  are random values each session This can be attack because the protocol does not authenticate participants    am i right for that understanding ? and an adversary can just participate in that key exchange ?
130,TL;DR Changed my GPG passphrase to something very simple as a test half of which I probably know half of which I forgot Now trying to brute force it with simple bash commands  Recently installed GnuPG to mess around Was messing around with the features Successfully changed the passphrase Unsuccessfully remembered the new passphrase  I dont have any important files encrypted with this key so its not life or death by any means Unfortunately I failed to download the revocation certificate before changing the passphrase I was really just messing around so I didnt take my usual steps with making and storing passwords  I wrote the passphrase down in a text file Ironically after messing around a little more I decided to encrypt that file and delete the original I know have a \`testtxtgpg\` binary blob containg the passphrase staring me in the face  Now the good news: I am 90 sure I used a super simple passphrase Just 2 words from the 7776 word \[EFFs Diceware Worldlist\][https:wwwefforgfiles20160718eff\_large\_wordlisttxt]https:wwwefforgfiles20160718eff_large_wordlisttxt Some more good news I am 95 sure I know one of the two words 70 sure its the first  Looking around in some other places I got this script to use assuming the first word is apple:      for i in cut f 2 eff_large_wordlisttxt ; do         echo applei | gpg batch passphrasefd 0 d testtxtgpg  break     done  This user who gave me that script said it would take about an hour to run through mine seems to try every word in about a minute to no success Is it even working right?  Again this is no major problem Just a mistake Im taking as an opportunity to learn about brute forcing  Any tips?
131, Im curious if anyone knows the answer to this because I certainly dont but it seems like a fun thought experiment because things like this have a way of illuminating just how far computers and cryptography have come since the days of Enigma let alone Caesar  Suppose two people each created keypairs and shared the public keys with each other so they can send encrypted messages back and forth Now suppose they had to do the encryption and decryption by hand sit down with pen and paper and encrypt a message from Alice to Bob and for Bob to decrypt the message back to plaintext  Assume any key length you like 2048 or 4096 or whatever Im just curious whether its technically possible just super impractical or if its one of those things that is on the order of heat death of the universe for a human to do  What do you think?
132,Im new on this and Id love to get to understand them down to a mathematical level
133,I have written a program to encrypt video files however I can not open it after encryption I want the output of the encryption to be able to play the file with encrypted bytes ie Should be able to play the file in its encrypted form like we do forpng file by keeping their header intact 
134,Beginner cryptographer here Will this work? And if not why not?   Step 1: Both millionnaire hash the numerical value of their wealth and convert the number to binary  Step 2: Millionaire A creates 10 bloom filters He fills each of them with random nonsense Then he updates each of them with the hash of his wealth This set of 10 bloom filters is given to millionaire B  Step 3: Millionaire B compares each bloom filter with the hash of his wealth and writes down how many bits correspond between the filter and his hash This gives him 10 numbers He then mixes up the 10 numbers and gives them to millionaire A this is to create a layer of obfuscation  Step 4: Millionaire A compared millionaire Bs answer with his what he would get with his own hash If they are the same he is reasonably sure that the two numbers were the same If not he knows for sure that they arent  Step 5 The previous steps are repeated but this time it is millionaire B that creates the bloom filters  Step 6 Each millionaire tells the other one if yes or no he thinks the numbers are the same based on the previous tests If they both say yes they are in all probability the same numbers therefore they have the same amount of money If not they dont have the same amount of money  Full disclosure: This isnt my own algorithm but something I found on a forum
135,Even though quantum computers are still far from the realistic requirements to break current algorithms it is good to know that researchers are already thinking of post quantum algos and these ones are only in the round 1  https:csrcnistgovProjectsPostQuantumCryptographyRound1Submissions
136,link: https:arstechnicacominformationtechnology201310arelativelyeasytounderstandprimeronellipticcurvecryptography  Im trying to understand elliptical curve cryptography but I got stuck in the beginning already:  >It turns out that if you have two points an initial point dotted with itself n times to arrive at a final point finding out n when you only know the final point and the first point is hard To continue our bizarro billiards metaphor imagine that one person plays our game alone in a room for a random period of time It is easy for him to hit the ball over and over following the rules described above If someone walks into the room later and sees where the ball has ended up even if they know all the rules of the game and where the ball started they cannot determine the number of times the ball was struck to get there without running through the whole game again until the ball gets to the same point Easy to do hard to undo  Shouldnt this be easy to do easy to undo? You just have to run through the whole game again So the decrypting attacker has to do the same amount of work as the encryptor  Further on in the article I get stuck again Am I such an idiot or are there better explanations on ECC available?
137,The character set 123456 can be perfectly random if the process that derived it was random  but that still wouldnt make for a good password Should it be more common practice for sensitive material generated by fantastic random processes to be verified for randomness by for example attacking it using common hacking tools dictionaries brute rainbow tables etc or similar before using it?    _ the word random is being used loosely in a practical sense
138, Hi Crypto experts  Could someone please clarify my question I have to send some very personal secret files to my friend who is far from where I live  Im not very familiar with cryptography concepts so I request please suggest me if my below approach is secure or not  1 Encrypt files with Peazip or 7Zip with long password   [ I read somewhere I internet that Peazip pea extension is secure as it has various options to encrypt files with EAX: AES 256 CTR  OMAC EAX: Twofish256 CTR  OMAC EAX: Serpen256 CTR  OMAC etc which one should I choose for secure file sharing or simply is 7Zip encryption will suffice?]  2 Share the password to my friend in Signal Messenger via text or call within the app so that he can decrypt the archive that I have sent I read that this messenger app is also e2e  I read about vera crypt but we both are very not technical hence instead of creating containers etc I believe that its easy for us to create encrypted archives are convenient for us   Please guide me is my approach correct way of sending my personal data  Thank You Regards
139,Hello  Ive been reading that securing electronic voting is an arduous perhaps impossible task  I had a simple idea to ensure verifiability Could you explain to me why it wouldnt be enough? I imagine im not the first to come up with the idea  If one after voting had a randomly generated unique receipt token and if the list of votes was published with the given tokens wouldnt this enable the voter to ensure his vote was indeed taken in to account ?  And if the voter had doubts that perhaps a token was issued multiple times that voter could publish their own token or share it with others so that a token issued multiple times would be recognized easily  Is there something wrong with this approach ?  sorry if this is not the right place to post this please advise if there is a better sub
140,Ever since I was little Ive enjoyed solving puzzles and a few years ago I wanted to start learning it but never had time  now I have time  and would like to know some info that would help me study it  for example what book should I buy  This year Ive entered a college for IT and would pursue learning cryptography that is linked with that feild   If anyone replies thanks in advance
141,I dont dabble much into the field of cryptography much but I read something somewhere about private key encryption I found that I understood the basic premise this made decent sense to me https:blogvrypannet20130828publickeycryptographyfornongeeks but despite extensive googling have no idea how it actually works most of the examples were written in Java My main issue with my current understanding is that it seems to me that it would be too easy to work backwards: if everyone has the same public key having a private key would be meaningless because someone else with the public key could simply look at the message and see what inputs yield the same outputs through the public key Im looking at this from a pen and paper perspective if a digital aspect is relevant  Thanks for helping me out edited for grammar
142,Im trying to find the weakness in a very simple form of symmetric cryptography  Using a shared seed value generate a random sequence of values in the range [0 256      randomseed123     rand = {84 219 37 0}  Perform addition mod 256 on each plaintext byte with the respective random value      Enc[n] := Plain[n]  rand0 256  256  This is the ciphertext To decipher generate the random offsets via the shared seed and perform subtraction mod 256 on each      Dec[n] := Enc[n]  rand0 256  256
143,Hi Im trying to understand how this system works  I already read the [Wikipedia article]https:enwikipediaorgwikiPublickey_cryptography and Im a bit confused  A clientserver example:A private key is stored on a server and the public key has been distributed to users via a phone app  Before sending data to the server the phone app uses the public key to encrypt the data but then how is the different private key used by the server to decrypt it?  Or is the private key a combination of the public and private keys and if so is the public key padded out to the full length key before encryption?  Finally is it feasible to have a different public  private key pair per user of a system?  Thanks
144,I dont know if this is the correct place to post this but have any breakthroughs been done on AES256 or lower and is it likely that this cipher can really protect data for thousands of yearsassuming you have good entropy  Tl;dr is there a high chance we may have breakthroughs on the algorithm its self within the next 5060 years? Or is AES not breakable if it is truly random?
145,Had a few queries from people at work today regarding the best way to store encryption keys and whilst I know of the best practices Ive never really heard of the confirmed best way to do so is there even one?   Obviously whilst the best way to store encryption keys is to not store them at all and require them to be entered whenever decryption is required; this is not feasible for all applications  My general assumption is that you should store the encryption keys separate to your encrypted data on another server implement key rotation policies and server auditing lock down the machine the keys are being stored on completely and encrypt those decryption keys with a master key that is stored on a hardware security module where possible  Is this a correct assumption or are there better ways to do so?
146,Im guessing you guys are already familiar with the algorithm so lets just say I picked these numbers:   p = 7  q = 13  n = 91  e = 5  d = 29  So the private key is 29 91 and the public key is 5 91 but its seems like you can use just one of them for both encryption and decryption:   T = 12  K = 12^5  91 = 38  T = 38^5  91 = 12    T = 42  K = 42^5  91 = 35  T = 35^5  91 = 42    T = 89  K = 89^29  91 = 59  T = 59^29  91 = 89  Why is this? Did I miss a step in the key creation? Is it because the numbers are too small?
